//UC1
mysql> CREATE DATABASE address_book;
Query OK, 1 row affected (0.04 sec)

mysql> show databases;
+--------------------+
| Database           |
+--------------------+
| information_schema |
| address_book       |
| mysql              |
| payroll_service    |
| performance_schema |
| sys                |
+--------------------+
6 rows in set (0.00 sec)


//UC2
mysql> CREATE TABLE Address_Book_Table
    -> (
    -> srNo     INT unsigned NOT NULL AUTO_INCREMENT,
    -> firstName  VARCHAR(150) NOT NULL,
    -> lastName   VARCHAR(150) NOT NULL,
    -> address   VARCHAR(250) NOT NULL,
    -> city     VARCHAR(150) NOT NULL,
    -> state   VARCHAR(150)  NOT NULL,
    -> zip      VARCHAR(150) NOT NULL,
    -> phoneNumber  VARCHAR(250) NOT NULL,
    -> email    VARCHAR(300) NOT NULL,
    -> PRIMARY KEY (srNo)
    -> );
Query OK, 0 rows affected (1.13 sec)

mysql> DESCRIBE Address_Book_TABLE;
+-------------+------------------+------+-----+---------+----------------+
| Field       | Type             | Null | Key | Default | Extra          |
+-------------+------------------+------+-----+---------+----------------+
| srNo        | int(10) unsigned | NO   | PRI | NULL    | auto_increment |
| firstName   | varchar(150)     | NO   |     | NULL    |                |
| lastName    | varchar(150)     | NO   |     | NULL    |                |
| address     | varchar(250)     | NO   |     | NULL    |                |
| city        | varchar(150)     | NO   |     | NULL    |                |
| state       | varchar(150)     | NO   |     | NULL    |                |
| zip         | varchar(150)     | NO   |     | NULL    |                |
| phoneNumber | varchar(250)     | NO   |     | NULL    |                |
| email       | varchar(300)     | NO   |     | NULL    |                |
+-------------+------------------+------+-----+---------+----------------+
9 rows in set (0.12 sec)


//UC3

mysql> INSERt INTO Address_Book_Table (firstName, lastName, address, city, state
, zip, phoneNumber, email) VALUES
    -> ('Atharva', 'Tathe', 'Temple Road', 'pandharpur', 'Maharashtra', '413304'
, '9999999999', 'atharva@gamil.com');
mysql> INSERt INTO Address_Book_Table (firstName, lastName, address, city, state, zip, phoneNumber, email) VALUES
    -> ('Ram', 'Kumar', 'powai fata', 'Mumbai', 'Maharashtra', '400001', '7777777777', 'ramkumar@g.com');
Query OK, 1 row affected (0.18 sec)
mysql> INSERt INTO Address_Book_Table (firstName, lastName, address, city, state, zip, phoneNumber, email) VALUES
    -> ('Alia', 'bhat', 'chinchvad', 'pune', 'Maharashtra', '400002', '5555555555', 'alia@kapur.com');
Query OK, 1 row affected (0.19 sec)


mysql> SELECT * FROM Address_Book_Table;
+------+-----------+----------+-------------+------------+-------------+--------+-------------+-------------------+
| srNo | firstName | lastName | address     | city       | state       | zip    | phoneNumber | email             |
+------+-----------+----------+-------------+------------+-------------+--------+-------------+-------------------+
|    1 | Atharva   | Tathe    | Temple Road | pandharpur | Maharashtra | 413304 | 888888888   | atharva@gamil.com |
|    2 | Ram       | Kumar    | powai fata  | Mumbai     | Maharashtra | 400001 | 7777777777  | ramkumar@g.com    |
|    3 | Alia      | bhat     | chinchvad   | pune       | Maharashtra | 400002 | 5555555555  | alia@kapur.com    |
+------+-----------+----------+-------------+------------+-------------+--------+-------------+-------------------+
3 rows in set (0.00 sec)


//UC4

mysql> update Address_Book_Table set phoneNumber = '9999999999' where firstName ='Atharva';
Query OK, 1 row affected (0.24 sec)
Rows matched: 1  Changed: 1  Warnings: 0

mysql> SELECT * FROM Address_Book_Table;
+------+-----------+----------+-------------+------------+-------------+--------+-------------+-------------------+
| srNo | firstName | lastName | address     | city       | state       | zip    | phoneNumber | email             |
+------+-----------+----------+-------------+------------+-------------+--------+-------------+-------------------+
|    1 | Atharva   | Tathe    | Temple Road | pandharpur | Maharashtra | 413304 | 9999999999  | atharva@gamil.com |
|    2 | Ram       | Kumar    | powai fata  | Mumbai     | Maharashtra | 400001 | 7777777777  | ramkumar@g.com    |
|    3 | Alia      | bhat     | chinchvad   | pune       | Maharashtra | 400002 | 5555555555  | alia@kapur.com    |
+------+-----------+----------+-------------+------------+-------------+--------+-------------+-------------------+
3 rows in set (0.00 sec)

//UC5

mysql> DELETE FROM Address_Book_Table where firstName = 'Alia';
Query OK, 1 row affected (0.14 sec)

mysql> SELECT * FROM Address_Book_Table;
+------+-----------+----------+-------------+------------+-------------+--------+-------------+-------------------+
| srNo | firstName | lastName | address     | city       | state       | zip    | phoneNumber | email             |
+------+-----------+----------+-------------+------------+-------------+--------+-------------+-------------------+
|    1 | Atharva   | Tathe    | Temple Road | pandharpur | Maharashtra | 413304 | 9999999999  | atharva@gamil.com |
|    2 | Ram       | Kumar    | powai fata  | Mumbai     | Maharashtra | 400001 | 7777777777  | ramkumar@g.com    |
+------+-----------+----------+-------------+------------+-------------+--------+-------------+-------------------+
2 rows in set (0.00 sec)


//UC6
mysql> SELECT * FROM Address_Book_Table where city = 'pandharpur';
+------+-----------+----------+-------------+------------+-------------+--------+-------------+-------------------+
| srNo | firstName | lastName | address     | city       | state       | zip    | phoneNumber | email             |
+------+-----------+----------+-------------+------------+-------------+--------+-------------+-------------------+
|    1 | Atharva   | Tathe    | Temple Road | pandharpur | Maharashtra | 413304 | 9999999999  | atharva@gamil.com |
+------+-----------+----------+-------------+------------+-------------+--------+-------------+-------------------+
1 row in set (0.00 sec)
